blue spice is a child friendly , 5 star restaurant near the riverside . it is in price range of £30 and up .	name blue spice | price_range more than £30 | customer_rating 5 out of 5 | area riverside | family_friendly yes
the plough is a cheap restaurant located next to the bakers . it is not family friendly .	name the plough | eat_type restaurant | price_range less than £20 | family_friendly no | near the bakers
the olive grove is a italian pub in riverside with a high price range and it is not a child friendly zone .	name the olive grove | eat_type pub | food italian | price_range high | area riverside | family_friendly no
there is a cheap restaurant browns cambridge it serves italian food . it has excellent customer reviews .	name browns cambridge | food italian | price_range cheap | customer_rating 5 out of 5
the olive grove is a moderately priced adult pub located in the city centre that serves english food .	name the olive grove | eat_type pub | food english | price_range moderate | area city centre | family_friendly no
the olive grove is a kid friendly pub and has average prices in riverside .	name the olive grove | eat_type pub | price_range £20-25 | area riverside | family_friendly yes
low rated but boasting low prices and a family-friendly fast-food experience , the waterman can be found in the city centre .	name the waterman | food fast-food | price_range less than £20 | customer_rating low | area city centre | family_friendly yes
with a 1 out of 5 customer rating and high price range , the golden palace coffee shop in riverside serves italian food .	name the golden palace | eat_type coffee shop | food italian | price_range high | customer_rating 1 out of 5 | area riverside
a coffee shop called the punter , near café sicilia , is family friendly and has average fast-food .	name the punter | eat_type coffee shop | food fast-food | price_range cheap | customer_rating average | family_friendly yes | near café sicilia
near the all bar one , in the riverside area , is a child friendly restaurant in the £30 range providing english food . the restaurant is called the green man .	name green man | food english | price_range more than £30 | area riverside | family_friendly yes | near all bar one
taste of cambridge is a restaurant with a price range of £30 plus and a high customer rating .	name taste of cambridge | eat_type restaurant | price_range more than £30 | customer_rating high
the golden curry provides indian food . with an average customer rating , it is also children friendly .	name the golden curry | food indian | customer_rating average | family_friendly yes
at a more than £30 price range , the waterman in city centre has japanese food . it is not family-friendly and has a low customer rating .	name the waterman | food japanese | price_range more than £30 | customer_rating low | area city centre | family_friendly no
the pub the olive grove area very great , the price are really moderate and the location is perfect for anyone , you can go with your kids .	name the olive grove | eat_type pub | price_range moderate | area city centre | family_friendly yes
midsummer house serves english food . they are rated 3 out of 5 and are high priced . they are located near all bar one .	name midsummer house | food english | price_range high | customer_rating average | near all bar one
the golden curry at the riverside near café rouge is rated 3 out of 5 , serves french food and is children friendly .	name the golden curry | food french | customer_rating 3 out of 5 | area riverside | family_friendly yes | near café rouge
wildwood offers french food in a pub setting with cheap prices , and it offers a 5 out of 5 rating .	name wildwood | eat_type pub | food french | price_range cheap | customer_rating 5 out of 5
the olive grove offers japanese style food and is child friendly .	name the olive grove | eat_type pub | food japanese | price_range moderate | area riverside | family_friendly yes
giraffe is a family friendly french pub by riverside .	name giraffe | eat_type pub | food french | area riverside | family_friendly yes
the eagle has a 5 out of 5 rating and is cheap . it is located in riverside .	name the eagle | price_range cheap | customer_rating 5 out of 5 | area riverside
family friendly chinese restaurant strada has dishes costing under 20 pounds and a low customer rating . it is located near rainbow vegetarian café .	name strada | food chinese | price_range less than £20 | customer_rating low | family_friendly yes | near rainbow vegetarian café
in riverside there is a pub called giraffe which serves english food and is family friendly .	name giraffe | eat_type pub | food english | area riverside | family_friendly yes
the vaults is a moderately priced , family friendly facility available for use , with pasta served .	name the vaults | food italian | price_range moderate | family_friendly yes
the eagle is a coffee shop having indian food less than £20 , it is family friendly with low customer rating , and located in riverside near burger king .	name the eagle | eat_type coffee shop | food indian | price_range less than £20 | customer_rating low | area riverside | family_friendly yes | near burger king
the cambridge blue is a pub located near café brazil , and provides affordable french food .	name the cambridge blue | eat_type pub | food french | price_range cheap | near café brazil
located in the city centre near the rice boat is a restaurant called the mill .	name the mill | eat_type restaurant | area city centre | near the rice boat
on the riverside there is a well priced restaurant called travellers rest beefeater . it is near café adriatic .	name travellers rest beefeater | price_range £20-25 | customer_rating high | area riverside | near café adriatic
the punter is a kids friendly and moderately price coffee shop . it has a customer rating of 3 out of , it serves indian food and is located near café sicilia .	name the punter | eat_type coffee shop | food indian | price_range moderate | customer_rating 3 out of 5 | family_friendly yes | near café sicilia
giraffe is a burger pub for adults located a few blocks north of city centre .	name giraffe | eat_type pub | food fast-food | area riverside | family_friendly no
the twenty two provides indian food	name the twenty two | food indian | family_friendly yes
a child-friendly fast-food establishment , browns cambridge , is located near the sorrento in riverside .	name browns cambridge | food fast-food | area riverside | family_friendly yes | near the sorrento
the eagle is a very highly rated chinese restaurant .	name the eagle | food chinese | customer_rating high
midsummer house , located near café rouge , has an average customer rating for their english cuisine .	name midsummer house | food english | customer_rating average | near café rouge
the golden palace , situated in the city centre , is a coffee shop that serves italian food with a customer rating of 3 out of 5 .	name the golden palace | eat_type coffee shop | food italian | price_range moderate | customer_rating 3 out of 5 | area city centre
low customer rating , pub and indian food , wildwood , has a price range of less than £20 .	name wildwood | eat_type pub | food indian | price_range less than £20 | customer_rating low
next to the rice boat , the twenty two is a higher end family restaurant .	name the twenty two | price_range high | customer_rating 3 out of 5 | area riverside | family_friendly yes | near the rice boat
travellers rest beefeater , situated near café adriatic in the city centre is rated 5 out of 5 by customers with a price range over 30 .	name travellers rest beefeater | price_range more than £30 | customer_rating 5 out of 5 | area city centre | near café adriatic
a riverside restaurant , the golden palace , is a 3 out of 5 .	name the golden palace | eat_type restaurant | customer_rating 3 out of 5 | area riverside
cocum is a kids friendly coffee shop with moderate price	name cocum | eat_type coffee shop | food french | price_range moderate | customer_rating 1 out of 5 | family_friendly yes
located in riverside is a cheap , family friendly pub called the olive grove	name the olive grove | eat_type pub | price_range cheap | area riverside | family_friendly yes
the golden curry is a fast-food restaurant that is not family friendly . their service only ranks in at 1 star according to reviews .	name the golden curry | food fast-food | customer_rating low | family_friendly no
close to the portland arms at riverside there is an outstanding coffee shop called cotto . they serve medium price range french food .	name cotto | eat_type coffee shop | food french | price_range more than £30 | customer_rating 5 out of 5 | area riverside | near the portland arms
child friendly , the olive grove pub serves japanese food on the riverside with a price range of more than £30 .	name the olive grove | eat_type pub | food japanese | price_range more than £30 | area riverside | family_friendly yes
there is a japanese coffee shop in the riverside area called the golden palace . it has a low customer rating , and costs more than £30 .	name the golden palace | eat_type coffee shop | food japanese | price_range more than £30 | customer_rating low | area riverside
the vaults is a pub near café adriatic and the price range is moderate . it is rated 3 out of 5 .	name the vaults | eat_type pub | price_range moderate | customer_rating 3 out of 5 | near café adriatic
the rice boat provides chinese food in the cheap price range . it is located in the city centre . it is near express by holiday inn . its customer rating is 5 out of 5 .	name the rice boat | food chinese | price_range cheap | customer_rating 5 out of 5 | area city centre | family_friendly yes | near express by holiday inn
the rice boat sells english food that is less than £20 , not family-friendly and has a customer rating that is low located in the city centre near express by holiday inn	name the rice boat | food english | price_range less than £20 | customer_rating low | area city centre | family_friendly no | near express by holiday inn
in city centre is a pub that is not kid friendly called the olive grove that has a moderate price range .	name the olive grove | eat_type pub | price_range moderate | area city centre | family_friendly no
for a less child friendly and more adult fast-food experience try the eagle coffee shop near the burger king in the riverside area . it charges a bit more than the average coffee shop but is highly rated .	name the eagle | eat_type coffee shop | food fast-food | price_range more than £30 | customer_rating high | area riverside | family_friendly no | near burger king
in the portland arms there is a nice 3 stars coffee shop cotto that provides low-priced food . it is located in the city centre .	name cotto | eat_type coffee shop | food french | price_range less than £20 | customer_rating average | area riverside | near the portland arms
although not family friendly , the green man is cheap and located on the river .	name green man | price_range less than £20 | area riverside | family_friendly no
the golden curry japanese restaurant has been given a top customer rating . it is located in the city centre close to café rouge . it is not suitable for families with children .	name the golden curry | food japanese | customer_rating 5 out of 5 | area city centre | family_friendly no | near café rouge
fitzbillies close to rainbow vegetarian café have less price range than £20 .	name fitzbillies | price_range less than £20 | near rainbow vegetarian café
green man is high-priced and child friendly , located next to the riverside .	name green man | price_range high | area riverside | family_friendly yes
next to the river you can find a nice family friendly fast-food restaurant which name is the waterman . the prices are mid-level .	name the waterman | food fast-food | price_range moderate | customer_rating 3 out of 5 | area riverside | family_friendly yes
strada a low price located near rainbow vegetarian café serving italian food no family-friendly with average customer rating	name strada | food italian | price_range cheap | customer_rating average | family_friendly no | near rainbow vegetarian café
near the portland arms is a children friendly indian coffee shop called the cricketers , ratings of 1 out of 5 .	name the cricketers | eat_type coffee shop | food indian | customer_rating 1 out of 5 | family_friendly yes | near the portland arms
zizzi is a pub that serves japanese food . it s not family-friendly but has a customer rating of 5 out of 5 .	name zizzi | eat_type pub | food japanese | customer_rating 5 out of 5 | family_friendly no
aromi is a family friendly but low-rated coffee shop that serves indian food near the riverside .	name aromi | eat_type coffee shop | food indian | customer_rating low | area riverside | family_friendly yes
for low priced english food there is the punter .	name the punter | food english | price_range cheap
the wrestlers , an establishment serving indian food that is moderately priced , and received a 1 out of 5 customer rating , however , be advised that it is not kids friendly .	name the wrestlers | food indian | price_range moderate | customer_rating 1 out of 5 | family_friendly no
near café rouge is a japanese , family friendly place called the golden curry . it is riverside and has high customer ratings .	name the golden curry | food japanese | customer_rating 5 out of 5 | area riverside | family_friendly yes | near café rouge
the giraffe is a pub located in riverside . they are kid-friendly and they serve fast-food .	name giraffe | eat_type pub | food fast-food | area riverside | family_friendly yes
if you are looking for a high quality , family-friendly dining experience in the heart of city centre , the eagle is for you . this coffee shop i near burger king and serves fast-food like it s gourmet .	name the eagle | eat_type coffee shop | food fast-food | price_range high | customer_rating average | area city centre | family_friendly yes | near burger king
there is a high priced kid friendly fast-food pub called the plough . it is near café rouge .	name the plough | eat_type pub | food fast-food | price_range more than £30 | family_friendly yes | near café rouge
the punter is an indian restaurant with cheap prices .	name the punter | food indian | price_range cheap
giraffe is near the bakers and is a coffee shop . it is not children friendly .	name giraffe | eat_type coffee shop | price_range more than £30 | customer_rating low | family_friendly no | near the bakers
the rice boat near rainbow vegetarian café has a rating of 5 out of 5 prices more than £30 .	name the rice boat | price_range more than £30 | customer_rating 5 out of 5 | near rainbow vegetarian café
the waterman is an average pub located in the riverside area that serves japanese food .	name the waterman | eat_type pub | food japanese | customer_rating average | area riverside
cocum is a up market child friendly coffee shop which also serves take away food	name cocum | eat_type coffee shop | food fast-food | price_range high | customer_rating 1 out of 5 | family_friendly yes
blue spice is a low-priced coffee shop located next to avalon that offers family friendly services .	name blue spice | eat_type coffee shop | price_range less than £20 | customer_rating low | area riverside | family_friendly no | near avalon
one of the best place for japanese food is strada near rainbow vegetarian café price range is very cheep its provide family friendly	name strada | food japanese | price_range cheap | customer_rating 5 out of 5 | family_friendly yes | near rainbow vegetarian café
the wrestlers coffee shop is family-friendly french food shop in city centre near raja indian cuisine with a price range less than £20 .	name the wrestlers | eat_type coffee shop | food french | price_range less than £20 | area city centre | family_friendly yes | near raja indian cuisine
strada is a pub located near yippee noodle bar that provides indian food which has a high customer rating .	name strada | eat_type pub | food indian | customer_rating high | near yippee noodle bar
the golden curry is a family friendly venue , serving english food . it is in the riverside area , near café rouge , with a rating of 5 out of 5 .	name the golden curry | food english | customer_rating 5 out of 5 | area riverside | family_friendly yes | near café rouge
clowns is a pub offering alcohol at prices higher than £ 30. customer ratings are low . it is located in the city center .	name clowns | eat_type pub | price_range more than £30 | customer_rating low | area city centre
the waterman is japanese restaurant in the riverside with price less than 20 , no average	name the waterman | food japanese | price_range less than £20 | customer_rating average | area riverside | family_friendly no
the eagle is a family friendly fast-food serving coffee ship with cheap price range and an average customer rating . it is located in riverside near burger king .	name the eagle | eat_type coffee shop | food fast-food | price_range cheap | customer_rating average | area riverside | family_friendly yes | near burger king
midsummer house is a pasta venue close to café rouge . it has one star .	name midsummer house | food italian | customer_rating low | near café rouge
there is a restaurant the mill located in riverside , close to the rice boat .	name the mill | eat_type restaurant | area riverside | near the rice boat
the waterman is a italian pub in the city center with a low customer rating .	name the waterman | eat_type pub | food italian | customer_rating low | area city centre
there is a family restaurant browns cambridge located on the riverside near the sorrento .	name browns cambridge | food fast-food | area riverside | family_friendly yes | near the sorrento
alimentum is located in the city centre . it has a high price range , serves italian and is children friendly .	name alimentum | food italian | price_range high | area city centre | family_friendly yes
blue spice is a one star , family friendly , high priced restaurant located in the city centre .	name blue spice | price_range more than £30 | customer_rating low | area riverside | family_friendly yes
ethnic variety foods up the road from crowne plaza hotel the browns cambridge coffee shop .	name browns cambridge | eat_type coffee shop | food japanese | customer_rating low | area riverside | family_friendly no | near crowne plaza hotel
the twenty two is a family friendly french restaurant on the riverside .	name the twenty two | food french | area riverside | family_friendly yes
customer rating 5 out of 5 , restaurant , the golden palace , in the centre of the city .	name the golden palace | eat_type restaurant | customer_rating 5 out of 5 | area city centre
5 out of 5 rating indian eatery with cheap prices near all bar one is midsummer house	name midsummer house | food indian | price_range cheap | customer_rating 5 out of 5 | near all bar one
the twenty two is priced below £20 and is family friendly . it is located in the riverside area near the rice boat . with a low customer rating .	name the twenty two | price_range less than £20 | customer_rating low | area riverside | family_friendly yes | near the rice boat
the rice boat is a moderately priced , kid-friendly , chinese restaurant . it s located in the city center near the express by holiday inn .	name the rice boat | food chinese | price_range moderate | customer_rating 3 out of 5 | area city centre | family_friendly yes | near express by holiday inn
the plough is a cheap family restaurant located near the bakers .	name the plough | eat_type restaurant | price_range less than £20 | family_friendly yes | near the bakers
the cricketers is family-friendly coffee shop with italian food . located near the portland arms , it has a 3 out of 5 rating .	name the cricketers | eat_type coffee shop | food italian | customer_rating average | family_friendly yes | near the portland arms
the pub type eatery zizzi is child friendly . it provides french food and has a customer rating of 3 out of 5 .	name zizzi | eat_type pub | food french | customer_rating 3 out of 5 | family_friendly yes
the family-friendly restaurant the rice boat is located near the express by holiday inn within the city centre . it is rated low and serves french food with prices less than £20 .	name the rice boat | food french | price_range less than £20 | customer_rating low | area city centre | family_friendly yes | near express by holiday inn
the golden palace is a coffee shop that offers french food with a price range less than £20 but it has a low customer rating . it is located in the city centre .	name the golden palace | eat_type coffee shop | food french | price_range less than £20 | customer_rating low | area city centre
the mill is an english pub near the riverside and has a price range of £20-£25 .	name the mill | eat_type pub | food english | price_range £20-25 | area riverside
the golden curry serves french food and has a customer rating of 3 out of 5. it is family-friendly and is located near café rouge , by the river .	name the golden curry | food french | customer_rating average | area riverside | family_friendly yes | near café rouge
the italian pub named strada has an average customer rating . it is near yippee noodle bar .	name strada | eat_type pub | food italian | customer_rating average | near yippee noodle bar
there is a child friendly eatery named cotto that serves chinese food and has average customer ratings . it is located near the ranch .	name cotto | food chinese | customer_rating average | family_friendly yes | near ranch
located in the centre of the city , close to raja indian cuisine , the wrestlers is a coffee shop offering italian food .	name the wrestlers | eat_type coffee shop | food italian | price_range moderate | area city centre | family_friendly no | near raja indian cuisine
the eagle is a coffee shop providing indian food in the more than £30 price range . it is located in the city centre . it is near burger king . its customer rating is high .	name the eagle | eat_type coffee shop | food indian | price_range more than £30 | customer_rating high | area city centre | family_friendly yes | near burger king
loch fyne fast-food in riverside has a high customer rating a great place to eat . near the rice boat .	name loch fyne | food fast-food | customer_rating high | area riverside | near the rice boat
cotto is a coffee shop in the average price range . it is located near the portland arms .	name cotto | eat_type coffee shop | food french | price_range moderate | customer_rating 1 out of 5 | area riverside | near the portland arms
unfortunately , the rice boat , though family-friendly , is a low-rating , italian restaurant in city center .	name the rice boat | food italian | customer_rating low | area city centre | family_friendly no
clowns friends ai nt cheap at café sicilia .	name clowns | price_range cheap | family_friendly yes | near café sicilia
the twenty two near the rice boat along the riverside , has a price of more then 30 euros , and is not children friendly however has high ratings at 5 of 5 with customer ratings .	name the twenty two | price_range more than £30 | customer_rating 5 out of 5 | area riverside | family_friendly no | near the rice boat
aromi is a fast-food restaurant by the riverside	name aromi | eat_type restaurant | food fast-food | area riverside
the olive grove is a pub within the city centre that serves indian food . the pub is children friendly and within the high price range .	name the olive grove | eat_type pub | food indian | price_range high | area city centre | family_friendly yes
browns cambridge providing french food . it is located in riverside area near the sorrento .	name browns cambridge | food french | area riverside | family_friendly no | near the sorrento
in the riverside area near express by holiday inn , there is a family friendly place serving cheap italian food called the rice boat which has a customer rating of 5 out of 5 .	name the rice boat | food italian | price_range cheap | customer_rating 5 out of 5 | area riverside | family_friendly yes | near express by holiday inn
the golden palace coffee shop has a high price range and serves italian food . it has a three star rating .	name the golden palace | eat_type coffee shop | food italian | price_range high | customer_rating average | area riverside
the vaults is a coffee shop in the riverside area , near café brazil . it has a customer rating of 3 out of 5 , and has a moderate price range .	name the vaults | eat_type coffee shop | price_range moderate | customer_rating 3 out of 5 | area riverside | near café brazil
browns cambridge serves japanese food , is kid friendly and located near the sorrento at the riverside .	name browns cambridge | food japanese | area riverside | family_friendly yes | near the sorrento
strada offers chinese food with a price range of more than £30 . the customer rating is high ; however , strada is not children friendly . strada is near rainbow vegetarian café .	name strada | food chinese | price_range more than £30 | customer_rating high | family_friendly no | near rainbow vegetarian café
the vaults is a average rated coffee shop with medium prices . they are located near café brazil .	name the vaults | eat_type coffee shop | price_range less than £20 | customer_rating average | area riverside | near café brazil
it is not a family-friendly place , but alimentum , in city centre , has english food with low pricing .	name alimentum | food english | price_range less than £20 | area riverside | family_friendly no
the olive grove serves english food in a pub style .	name the olive grove | eat_type pub | food english | price_range high | area city centre | family_friendly yes
