the rice boat serves french food and is located at the riverside . they are kid friendly and have high customer ratings .	name the rice boat | food french | customer_rating high | area riverside | family_friendly yes
browns cambridge is a lowly rated italian restaurant with mid-ranged prices .	name browns cambridge | food italian | price_range moderate | customer_rating 1 out of 5
located near the rainbow vegetarian café is strada , which is a non children friendly place that serves fast-food in the more than £30 price range .	name strada | food fast-food | price_range more than £30 | customer_rating high | family_friendly no | near rainbow vegetarian café
an adult oriented italian restaurant called strada has a low customer rating , but a moderate price range , and is located near the rainbow vegetarian café .	name strada | food italian | price_range moderate | customer_rating 1 out of 5 | family_friendly no | near rainbow vegetarian café
there is a cheap family friendly coffee shop near café sicilia called the punter . it has average customer rating .	name the punter | eat_type coffee shop | food indian | price_range cheap | customer_rating average | family_friendly yes | near café sicilia
clowns is a coffee shop near clare hall in riverside . it serves japanese food and has a customer rating of 5 out of 5 .	name clowns | eat_type coffee shop | food japanese | customer_rating 5 out of 5 | area riverside | near clare hall
the waterman has a low customer rating 1 out of 5 perhaps because it is nt a friendly place for kids . it serves french food and is moderately priced and can be found in the city centre .	name the waterman | food french | price_range moderate | customer_rating 1 out of 5 | area city centre | family_friendly no
fitzbillies is a highly priced coffee shop in the city centre that provides indian food .	name fitzbillies | eat_type coffee shop | food indian | price_range high | customer_rating average | area city centre | family_friendly yes
a pub serving french food near riverside called the olive grove is above-average price . it is not kid friendly .	name the olive grove | eat_type pub | food french | price_range more than £30 | area riverside | family_friendly no
the olive grove is located in city centre . they are a pub type restaurant that is not kid friendly with moderate prices .	name the olive grove | eat_type pub | food italian | price_range moderate | area city centre | family_friendly no
a children-friendly place for chinese food , the vaults  offers a culinary experience ranging anything above £30 .	name the vaults | food chinese | price_range more than £30 | family_friendly yes
clowns coffee shop offers fast-food with an average customer rating . it is located near clare hall in riverside .	name clowns | eat_type coffee shop | food fast-food | customer_rating average | area riverside | near clare hall
the midsummer house is a chinese food place in the moderate price range with a customer rating of 1 out of 5 near all bar one .	name midsummer house | food chinese | price_range moderate | customer_rating 1 out of 5 | near all bar one
fitzbillies is a high-priced italian coffee shop in riverside . it has an average customer rating .	name fitzbillies | eat_type coffee shop | food italian | price_range high | customer_rating average | area riverside | family_friendly no
the wrestlers offers average , expensive indian food in an adult friendly environment .	name the wrestlers | food indian | price_range high | customer_rating average | family_friendly no
aromi is a restaurant in the area of riverside that has italian food .	name aromi | eat_type restaurant | food italian | area riverside
there is a restaurant located in city centre serving english food called the rice boat . due to being unfriendly to families , their customer service rating is low .	name the rice boat | food english | customer_rating low | area city centre | family_friendly no
the rice boat is a chinese based food place located in riverside . it is average and family friendly .	name the rice boat | food chinese | customer_rating average | area riverside | family_friendly yes
the plough is a restaurant that is a little expensive . find it near the bakers . it s not children friendly .	name the plough | eat_type restaurant | price_range more than £30 | family_friendly no | near the bakers
located on the riverfront , north of the city centre , one-star the rice boat  restaurant serves traditional british cuisine . the restaurant is not suitable for families .	name the rice boat | food english | customer_rating low | area riverside | family_friendly no
wildwood is a restaurant that sells english food .	name wildwood | eat_type pub | food english | price_range moderate | customer_rating 3 out of 5
there is a fast-food restaurant called browns cambridge . it is rated 5 out of 5 with an average spend exceeding £30 .	name browns cambridge | food fast-food | price_range more than £30 | customer_rating 5 out of 5
if you are looking for a family friendly pub , the olive grove is perfect for you . it is a cheap establishment that is located north of the city centre , close to the river .	name the olive grove | eat_type pub | food fast-food | price_range less than £20 | area riverside | family_friendly yes
fitzbillies is nt rated very high . located in express by holiday inn , the food is priced more than £30 , and it s not a very child friendly venue either .	name fitzbillies | price_range more than £30 | customer_rating low | family_friendly no | near express by holiday inn
the twenty two is an average family friendly restaurant located near the rice boat on the riverside , and costs less than 20 .	name the twenty two | price_range less than £20 | customer_rating average | area riverside | family_friendly yes | near the rice boat
wildwood is a cheap and a low rated fast-food .	name wildwood | eat_type pub | food fast-food | price_range less than £20 | customer_rating low
the eagle is a kid friendly coffee shop located near burger king in the city centre . they serve japanese food with a price range of 20-25 and are rated 3 out of 5 .	name the eagle | eat_type coffee shop | food japanese | price_range £20-25 | customer_rating 3 out of 5 | area city centre | family_friendly yes | near burger king
the rice boat is located in city centre near express by holiday inn . the are cheap sushi restaurant with high ratings and a family friendly atmosphere .	name the rice boat | food japanese | price_range cheap | customer_rating 5 out of 5 | area riverside | family_friendly yes | near express by holiday inn
the rice boat is a children friendly restaurant located in the riverside near express by holiday inn that provides indian food which has a high customer rating and the price range is more than £30 .	name the rice boat | food indian | price_range more than £30 | customer_rating high | area riverside | family_friendly yes | near express by holiday inn
the waterman that is a chinese joint has dishes ranging from 20-25 also has a high customer rating . located in the city centre , the waterman is kid friendly	name the waterman | food chinese | price_range £20-25 | customer_rating high | area city centre | family_friendly no
the dumpling tree is a family friendly french pub located near the portland arms .	name the dumpling tree | eat_type pub | food french | family_friendly yes | near the portland arms
the mill is a pub that provides chinese food in the high price range . it is located in the city centre .	name the mill | eat_type pub | food chinese | price_range high | area city centre
the golden curry offers fast-food in a child friendly setting . customers rated it 5 out of 5 .	name the golden curry | food fast-food | customer_rating 5 out of 5 | family_friendly yes
if you are looking for cheap italian pub food , go to wildwood restaurant , which has an average customer rating .	name wildwood | eat_type pub | food italian | price_range cheap | customer_rating average
browns cambridge has a low customer rating and is cheap .	name browns cambridge | price_range less than £20 | customer_rating low
the cambridge blue is a 5 stars restaurant that delivers take-away .	name the cambridge blue | eat_type restaurant | food japanese | customer_rating 5 out of 5
the rice boat is a kid friendly riverside restaurant . customer ratings are 1 out of 5 stars .	name the rice boat | food french | customer_rating 1 out of 5 | area riverside | family_friendly yes
the golden palace is a high rated restaurant in the city center .	name the golden palace | eat_type restaurant | customer_rating 5 out of 5 | area city centre
taste of cambridge is a kid friendly coffee shop in the riverside area that offers japanese food near the crowne plaza hotel	name taste of cambridge | eat_type coffee shop | food japanese | area riverside | family_friendly yes | near crowne plaza hotel
the waterman is near crowne plaza hotel that offers french food and is family friendly .	name the waterman | food french | family_friendly yes | near crowne plaza hotel
wildwood is a more expensive coffee shop .	name wildwood | eat_type coffee shop | food french | price_range £20-25 | customer_rating 3 out of 5 | near ranch
the rice boat is situated by the river , and within a short walk of the express by holiday inn . it is in the cheap price range , and sells burgers , fries and soft drinks . it is not a family-friendly establishment .	name the rice boat | food fast-food | price_range less than £20 | customer_rating low | area riverside | family_friendly no | near express by holiday inn
the vaults serves fast-food and costs more than £30 . not suitable for children .	name the vaults | food fast-food | price_range more than £30 | family_friendly no
the phoenix in the city centre serves french food with low customer ratings .	name the phoenix | food french | customer_rating low | area city centre
italian-style cuisine at prices lower than £20 is available at bibimbap house , in the riverside area . a close-by landmark is clare hall .	name bibimbap house | food italian | price_range less than £20 | area riverside | near clare hall
the phoenix at riverside is rated 5 out of 5 and serves fast-food at cheap prices	name the phoenix | food fast-food | price_range cheap | customer_rating 5 out of 5 | area riverside
english food is available in a kid friendly restaurant called loch fyne . the food is moderately priced .	name loch fyne | eat_type restaurant | food english | price_range moderate | family_friendly yes
come to our children friendly pub called cocum . it has a average customer rating and the prices are high .	name cocum | eat_type pub | price_range high | customer_rating average | family_friendly yes
the loch fyne restaurant serves japanese food and is family friendly .	name loch fyne | eat_type restaurant | food japanese | family_friendly yes
there is a pub where kids are very welcome that sell fast-food , it is called the dumpling tree and is situated close to the portland arms	name the dumpling tree | eat_type pub | food fast-food | family_friendly yes | near the portland arms
near to all bar one is a family friendly , riverside italian called green man . meals cost less than £20 .	name green man | food italian | price_range less than £20 | area riverside | family_friendly yes | near all bar one
the cricketers an average price family friendly coffee shop located near the portland arms .	name the cricketers | eat_type coffee shop | food french | customer_rating average | family_friendly yes | near the portland arms
the eagle is an italian style coffee shop with high customer ratings near burger king in the city centre . it is not child friendly and the price range is more the 30 pounds .	name the eagle | eat_type coffee shop | food italian | price_range more than £30 | customer_rating high | area city centre | family_friendly no | near burger king
the rice boat is a highly rated child friendly indian restaurant by the riverside .	name the rice boat | food indian | customer_rating high | area riverside | family_friendly yes
if you want some coffee with a good view and kid friendly , blue spice is the right place for you . it s located near avalon the prices are affordable and it has a very good customer rating .	name blue spice | eat_type coffee shop | price_range moderate | customer_rating 3 out of 5 | area riverside | family_friendly yes | near avalon
the phoenix is a 5 star facility available for your use , with wine cheese and fruit served .	name the phoenix | food french | customer_rating 5 out of 5 | area riverside
there is a kids friendly french pub the dumpling tree located near the portland arms .	name the dumpling tree | eat_type pub | food french | family_friendly yes | near the portland arms
the olive grove is a pub that provides chinese food in the high price range . it is located in the city centre .	name the olive grove | eat_type pub | food chinese | price_range high | area city centre | family_friendly yes
zizzi is an average restaurant that serves italian pub fare . it is not family-friendly .	name zizzi | eat_type pub | food italian | customer_rating average | family_friendly no
the waterman is a restaurant for adults located in the city centre . it is an indian restaurant with a less than 20 price range and a low customer rating .	name the waterman | food indian | price_range less than £20 | customer_rating low | area city centre | family_friendly no
alimentum serves english food . it is located near yippee noodle bar at the riverside . the customer rating is 1 out of 5 , it has a high price range .	name alimentum | food english | price_range high | customer_rating 1 out of 5 | area riverside | near yippee noodle bar
cocum coffee shop is located in the center . of town . conveniently located among other shops .	name cocum | eat_type coffee shop | food italian | price_range high | customer_rating 1 out of 5 | family_friendly yes
a good place to get low priced sushi without the kids is the green man . it is located on the river in city centre close to all bar one .	name green man | food japanese | price_range less than £20 | area riverside | family_friendly no | near all bar one
in the city centre is a french restaurant called the waterman , is has a low customer rating , has a price range of more than £30 , and is not kid-friendly .	name the waterman | food french | price_range more than £30 | customer_rating low | area city centre | family_friendly no
the golden curry features chinese cuisine and has earned a customer rating of 5 out of 5. this establishment is not open to families .	name the golden curry | food chinese | customer_rating 5 out of 5 | family_friendly no
the rice boat serves an excellent steak and eggs , located near express by holiday inn .	name the rice boat | food english | price_range high | customer_rating 1 out of 5 | area riverside | family_friendly yes | near express by holiday inn
fitzbillies is an average rated coffee shop which serves cheap indian food . they are located riverside and are family friendly .	name fitzbillies | eat_type coffee shop | food indian | price_range cheap | customer_rating average | area riverside | family_friendly yes
check out strada , a family friendly restaurant located near the rainbow vegetarian café offering fast-food .	name strada | food fast-food | price_range less than £20 | customer_rating low | family_friendly yes | near rainbow vegetarian café
in riverside near clare hall there is a coffee shop which sells fast-food , it is called clowns and customers have rated it as high .	name clowns | eat_type coffee shop | food fast-food | customer_rating high | area riverside | near clare hall
located in the city centre , the twenty two is a fast-food restaurant that is not family friendly .	name the twenty two | food fast-food | area riverside | family_friendly no
the mill is a pub type restaurant near riverside .	name the mill | eat_type pub | food french | price_range high | area riverside
the rice boat is an english restaurant located near express by holiday inn in the centre of the city with a customer rating of 3 out of 5 and is kids friendly with a moderate price range .	name the rice boat | food english | price_range moderate | customer_rating 3 out of 5 | area city centre | family_friendly no | near express by holiday inn
blue spice is a highly recommended family friendly , low cost restaurant with a water view .	name blue spice | price_range cheap | customer_rating 5 out of 5 | area riverside | family_friendly yes
the eagle is great sushi at affordable prices . located near burger king .	name the eagle | eat_type coffee shop | food japanese | price_range £20-25 | customer_rating high | area riverside | family_friendly yes | near burger king
there is a child friendly restaurant . it is called wildwood .	name wildwood | eat_type restaurant | family_friendly yes
the wrestlers is a coffee shop that provides japanese food for a high cost . the restaurant is located by the margin of the river , next to raja indian cuisine .	name the wrestlers | eat_type coffee shop | food japanese | price_range more than £30 | area riverside | family_friendly yes | near raja indian cuisine
japanese food can be bought at the cricketers . this is a child friendly coffee shop located near to the portland arms . customers have given it a rating of 3 out of 5 .	name the cricketers | eat_type coffee shop | food japanese | customer_rating 3 out of 5 | family_friendly yes | near the portland arms
the vaults pub is near café adriatic . it has a high customer rating and a price range more than 30 pounds .	name the vaults | eat_type pub | price_range more than £30 | customer_rating high | near café adriatic
cocum as a coffee shop is rated average but not a choice for family . they provide italian food .	name cocum | eat_type coffee shop | food italian | price_range cheap | customer_rating average | family_friendly no
a nice , inexpensive place that is fun for the whole family is clowns . it is close to café sicilia .	name clowns | price_range less than £20 | family_friendly yes | near café sicilia
located in city centre , the phoenix has a high customer rating and serves chinese food in a price range of £20-25 .	name the phoenix | food chinese | price_range £20-25 | customer_rating high | area city centre
the wrestlers serve indian food that is cheap , it is family friendly , and rated five out of five .	name the wrestlers | food indian | price_range cheap | customer_rating 5 out of 5 | family_friendly yes
customers are prepared to pay above average for italian food at the cotto which has an excellent reputation . it is near the portland arms at the riverside and is a coffee shop .	name cotto | eat_type coffee shop | food italian | price_range more than £30 | customer_rating high | area riverside | near the portland arms
the rice boat is a restaurant providing japanese food . it is located in the city centre .	name the rice boat | food japanese | customer_rating average | area city centre | family_friendly yes
the cambridge blue is a japanese restaurant with a customer rating of 5 out of 5 .	name the cambridge blue | eat_type restaurant | food japanese | customer_rating 5 out of 5
in the city centre is a family-friendly french coffee shop called fitzbillies . it is less £20 and has an average customer rating .	name fitzbillies | eat_type coffee shop | food french | price_range less than £20 | customer_rating average | area city centre | family_friendly yes
near the riverside and café brazil , is a coffee shop named the vaults which has a moderate price range and a customer rating of one out of five .	name the vaults | eat_type coffee shop | price_range moderate | customer_rating 1 out of 5 | area riverside | near café brazil
i visited a coffee shop called the golden palace that served japanese food in the city centre for a moderate price . it was nt very good though ; it s reviews are only 1 out of 5 stars .	name the golden palace | eat_type coffee shop | food japanese | price_range moderate | customer_rating 1 out of 5 | area city centre
the golden curry is a chinese restaurant with a 5 out of 5 customer rating and is family friendly .	name the golden curry | food chinese | customer_rating 5 out of 5 | family_friendly yes
the punter is a family coffee shop with italian food with high prices but also an average rating , its close to café sicilia	name the punter | eat_type coffee shop | food italian | price_range high | customer_rating average | family_friendly yes | near café sicilia
bibimbap house is a fairly inexpensive wine tasting restaurant that is located near the clare hall .	name bibimbap house | food french | price_range moderate | area riverside | near clare hall
kid friendly , the twenty two serves chinese foods .	name the twenty two | food chinese | family_friendly yes
located in the riverside area is the restaurant zizzi which has a typical price range of above £30	name zizzi | eat_type restaurant | price_range more than £30 | area riverside
cocum is a family friendly coffee shop . they offer drink at a reasonable price and have been rated three stars .	name cocum | eat_type coffee shop | food fast-food | price_range moderate | customer_rating 3 out of 5 | family_friendly yes
there is a restaurant , called the plough , that is not children friendly , near the bakers , it costs more then 30 pounds .	name the plough | eat_type restaurant | price_range more than £30 | family_friendly no | near the bakers
there is a fast-food restaurant named the vaults with prices more than £30 and is not child friendly .	name the vaults | food fast-food | price_range more than £30 | family_friendly no
in the city centre area near clare hall is , bibimbap house . serving chinese for a moderate price .	name bibimbap house | food chinese | price_range moderate | area city centre | near clare hall
in the area of city centre near the rice boat there is loch fyne that serves fast-food that has a customer rating of 5 out of 5 .	name loch fyne | food fast-food | customer_rating 5 out of 5 | area city centre | near the rice boat
zizzi is a fast-food pub which is not family-friendly and a customer rating of 5 .	name zizzi | eat_type pub | food fast-food | customer_rating 5 out of 5 | family_friendly no
the rice boat is a restaurant offering chinese food and has an average rating . it is child friendly and is located at a riverside .	name the rice boat | food chinese | customer_rating average | area riverside | family_friendly yes
near all bar one in city centre is green man . with a higher price range , this adult establishment serves fast-food .	name green man | food fast-food | price_range high | area city centre | family_friendly no | near all bar one
the plough is a mid price restaurant close to the bakers . it is aimed for adults only .	name the plough | eat_type restaurant | price_range moderate | family_friendly no | near the bakers
the waterman sells sushi at low prices . it is not family-friendly .	name the waterman | food japanese | price_range less than £20 | customer_rating low | area riverside | family_friendly no
the cambridge blue is an indian pub with cheap prices , located near café brazil .	name the cambridge blue | eat_type pub | food indian | price_range cheap | near café brazil
there is a non children friendly english restaurant with a high customer rating and a price range of more than 30 euros named the wrestlers .	name the wrestlers | food english | price_range more than £30 | customer_rating high | family_friendly no
a coffee shop near burger king in the city center called the eagle serves italian food . it is rated low , not child friendly and priced high .	name the eagle | eat_type coffee shop | food italian | price_range high | customer_rating 1 out of 5 | area city centre | family_friendly no | near burger king
the plough pub provides british food in the low price range , located near café rouge . families are not permitted in the premises .	name the plough | eat_type pub | food english | price_range less than £20 | family_friendly no | near café rouge
there is a cheap italian restaurant near yippee noodle bar in the riverside area , called alimentum that customers rate 5 out of 5 .	name alimentum | food italian | price_range cheap | customer_rating 5 out of 5 | area riverside | near yippee noodle bar
in city centre near the portland arms , is the coffee shop cotto . cotto features an average-priced menu that receives 5 out of 5 stars from customers . the coffee shop serves japanese food .	name cotto | eat_type coffee shop | food japanese | price_range £20-25 | customer_rating high | area riverside | near the portland arms
the waterman is an average priced japanese restaurant . it is kid friendly with a rating of 3 out of 5. located in the city centre .	name the waterman | food japanese | price_range £20-25 | customer_rating 3 out of 5 | area city centre | family_friendly yes
strada is a family friendly restaurant in the low price range . it has been highly rated by customers .	name strada | price_range cheap | customer_rating 5 out of 5 | family_friendly yes
there is a place called the rice boat , it s of high price , but average customer rating near the rainbow vegetarian café .	name the rice boat | price_range high | customer_rating average | near rainbow vegetarian café
midsummer house has a high customer raring , it serves italian food and is located near café rouge .	name midsummer house | food italian | customer_rating 5 out of 5 | near café rouge
near the six bells is the kid friendly place the golden curry .	name the golden curry | family_friendly yes | near the six bells
alimentum is a chinese restaurant in the center of the city near a yippee noodle bar , its customer rating is a 5 out of 5 .	name alimentum | food chinese | price_range cheap | customer_rating 5 out of 5 | area city centre | near yippee noodle bar
